mysql> create table book_publishing_company(id int(2),name char(20),author char(30),cost int(5));
Query OK, 0 rows affected (0.03 sec)

mysql> desc book_publishing_company;
+--------+----------+------+-----+---------+-------+
| Field  | Type     | Null | Key | Default | Extra |
+--------+----------+------+-----+---------+-------+
| id     | int(2)   | YES  |     | NULL    |       |
| name   | char(20) | YES  |     | NULL    |       |
| author | char(30) | YES  |     | NULL    |       |
| cost   | int(5)   | YES  |     | NULL    |       |
+--------+----------+------+-----+---------+-------+
4 rows in set (0.02 sec)

mysql> insert into book_publishing_company values('1','physics','einstien','499'),('2','maths','kishore','299'),('3','chemistry','bohr','999');
Query OK, 3 rows affected (0.00 sec)
Records: 3  Duplicates: 0  Warnings: 0

mysql> select * from book_publshing_company;
ERROR 1146 (42S02): Table 'varsha.book_publshing_company' doesn't exist
mysql> select * from book_publishing_company;
+------+-----------+----------+------+
| id   | name      | author   | cost |
+------+-----------+----------+------+
|    1 | physics   | einstien |  499 |
|    2 | maths     | kishore  |  299 |
|    3 | chemistry | bohr     |  999 |
+------+-----------+----------+------+
3 rows in set (0.00 sec)

mysql> alter table book_publishing_company add qty int(5);
Query OK, 3 rows affected (0.03 sec)
Records: 3  Duplicates: 0  Warnings: 0
mysql> select * from book_publishing_company;
+------+-----------+----------+------+------+
| id   | name      | author   | cost | qty  |
+------+-----------+----------+------+------+
|    1 | physics   | einstien |  499 | NULL |
|    2 | maths     | kishore  |  299 | NULL |
|    3 | chemistry | bohr     |  999 | NULL |
+------+-----------+----------+------+------+
3 rows in set (0.00 sec)

mysql> delete from book_publishing_company where price='499';
ERROR 1054 (42S22): Unknown column 'price' in 'where clause'
mysql> delete from book_publishing_company where cost='499';
Query OK, 1 row affected (0.00 sec)

mysql> select * from book_publishing_company;
+------+-----------+---------+------+------+
| id   | name      | author  | cost | qty  |
+------+-----------+---------+------+------+
|    2 | maths     | kishore |  299 | NULL |
|    3 | chemistry | bohr    |  999 | NULL |
+------+-----------+---------+------+------+
2 rows in set (0.00 sec)